{
  "$schema": "https://json-schema.org/draft/2020-12/schema",
  "$id": "urn:core-dev:guard.policy.schema.json",
  "title": "bash-guard policy",
  "description": "Repo-specific parameters for the vendored bash-guard.sh. Everything here is per-repo; the guard core is identical across repos. Strict defaults apply when a key (or the whole file) is absent: an absent policy never weakens the guard.",
  "type": "object",
  "additionalProperties": false,
  "properties": {
    "$comment": {
      "type": ["string", "array"],
      "items": { "type": "string" },
      "description": "Free text for the people who maintain this policy: why a value is what it is, who decided it and when. One string, or an array of strings (one paragraph each). No guard reads it. Allowed only at the top level: every other object here is closed, and a `why` already carries the reason for each reserved path."
    },
    "agent_may_merge": {
      "type": "boolean",
      "default": false,
      "description": "Whether the agent may merge a PR whose base is the integration branch. A merge whose base is the protected branch is ALWAYS denied (human-only), regardless of this flag. false → the agent may not merge any PR (e.g. trunk→main repos, where the only base is the protected branch)."
    },
    "require_pr_label": {
      "type": "boolean",
      "default": true,
      "description": "Whether `gh pr create` must carry --label: the release gate of a product repository reads a semver label from the PR. false only in a repository whose releases do not read PR labels (e.g. release-please from the commits, or a version bump in a manifest). The waiver covers PRs that LAND in this repository, from any session: a `gh pr create --repo <this repo>` run elsewhere reads this value from this repository's origin, as a cross-repository merge does. A PR toward another repository follows that repository's own value, and one whose target or policy the guard cannot read still needs the label."
    },
    "protected_branch": {
      "type": "string",
      "default": "main",
      "description": "The reviewed/released line. Direct push is forbidden and merging a PR into it is human-only. Universal value 'main' in this fleet. It also binds pushes from OTHER repositories' sessions (git -C, a URL): the guard reads this value from this repository's origin, so a repository that vendors no policy has no protected branch for the guard, and one whose policy cannot be read gets 'main'."
    },
    "integration_branch": {
      "type": "string",
      "default": "",
      "description": "The live integration branch a merge may target when agent_may_merge is true (e.g. 'develop' for the products). Empty for trunk→main repos."
    },
    "generated_trees": {
      "type": "array",
      "items": { "type": "string" },
      "default": [],
      "description": "Paths of auto-generated trees that must not be hand-edited (e.g. a Prisma output dir). Empty → all generated-tree checks are skipped (short-circuit: an empty tree must never match every write)."
    },
    "generated_regen_hint": {
      "type": "string",
      "default": "",
      "description": "The command/instruction to regenerate the tree, shown in the deny message (e.g. 'edit schema.prisma and run pnpm build')."
    },
    "egress_allow": {
      "type": "array",
      "items": { "type": "string" },
      "default": ["localhost", "127.0.0.1", "::1"],
      "description": "Hosts curl/wget may reach. Universal policy: network egress is restricted to this allow-list in every repo. Extend per-repo only with a ratified reason."
    },
    "one_worktree_per_task": {
      "type": "boolean",
      "default": false,
      "description": "true → the agent may not switch branches (git switch, git checkout <branch>, -b/-c/--detach) in a SHARED checkout: the main worktree (not a linked one) of this repository, of a repository next to it (same parent directory) or of one inside it. Every session working in that checkout sees its files change under it; a task gets its own worktree (git worktree add). Restoring files (git checkout -- <path>, git checkout <existing path>, git checkout -p) still passes, and so does any switch in a linked worktree or in a clone elsewhere. The directory is the session's (the hook input's cwd), followed through cd and git -C. false or absent → no such rule: a repository opts in."
    },
    "forbidden_paths": {
      "type": "array",
      "default": [],
      "description": "Directories no session of this repository may touch, each `~/<dir>` (the home of the user running the session) or absolute. Denied: a Bash, Monitor or PowerShell command that names a path under one (as ~, $HOME, ${HOME} or the absolute home, anywhere in the command text, heredoc bodies included) and a session whose working directory is under one. A recursive read that follows links (`find -L`, `grep -R`, `rg -L`, `du -L`, `cp -rL`, `tar -h`, zip…) is denied when the directory it starts from holds a link into one (or into a directory above one), and when that directory is larger than the guard looks through (40 levels, 50 000 names). The file tools are judged too (their path, resolved with symlinks followed, and a Glob pattern rooted in one) when this repository's .claude/settings.json also wires bash-guard.sh as a PreToolUse hook with matcher `Read|Edit|Write|MultiEdit|NotebookEdit|Grep|Glob`. Empty or absent → no such rule.",
      "items": { "type": "string", "pattern": "^(~/.+|/.+)$" }
    },
    "set_phase_cmd": {
      "type": "string",
      "default": "",
      "description": "How sdd-gate.sh names the sanctioned phase mutator in its deny messages. Absent → it names the core-dev plugin's scripts/opsx/set-phase.sh, which is the right answer for a repo on the plugin-only engine. Set it only where the repo still vendors its own mutator and the deny must point somewhere else."
    },
    "reserved_paths": {
      "type": "array",
      "default": [],
      "description": "Surfaces this repo reserves to the owner ON TOP of the built-in floor of the pr-score gate (skills/pr-score/scripts/reserved-surface.sh). A PR that touches one is escalated instead of auto-merged. The floor itself cannot be configured away. Globs match the repo-relative path; `**` crosses directories, `*` does not.",
      "items": {
        "type": "object",
        "additionalProperties": false,
        "required": ["glob"],
        "properties": {
          "glob": {
            "type": "string",
            "minLength": 1,
            "description": "e.g. 'apps/api/src/routes/public/**'."
          },
          "why": {
            "type": "string",
            "description": "The surface, in a few words; shown next to the path when the gate escalates."
          }
        }
      }
    },
    "reserved_paths_hard": {
      "type": "array",
      "default": [],
      "description": "Like reserved_paths, but HARD: these paths stay the owner's even when the repo opts into the owner-decision lens (owner_lens), where an independent reviewer decides by content whether a change on the rest of the reserved surface needs the owner. Checked by `reserved-surface.sh --hard-only` together with the built-in hard subset (the guard and hooks, the merge-gate scripts, the guard policy, the agent's cabling, security/, the data model). Also reserved in the default mode, so a caller that never passes the flag cannot merge over them. Absent → only the built-in hard subset.",
      "items": {
        "type": "object",
        "additionalProperties": false,
        "required": ["glob"],
        "properties": {
          "glob": {
            "type": "string",
            "minLength": 1,
            "description": "e.g. 'apps/api/src/billing/**'."
          },
          "why": {
            "type": "string",
            "description": "The surface, in a few words; shown next to the path when the gate escalates."
          }
        }
      }
    },
    "owner_lens": {
      "type": "boolean",
      "default": false,
      "description": "Opt-in to the owner-decision lens (skills/owner-decision). false or absent → nothing changes: every hit of reserved-surface.sh escalates, as always. true → the merge procedure asks an independent, fresh-context reviewer whether the change contains a decision that belongs to the owner, and gates on its verdict with skills/pr-score/scripts/owner-gate.py; a path hit in the hard subset (reserved-surface.sh --hard-only) still goes to the owner always, a path hit outside it proceeds only if the lens finds nothing."
    },
    "pr_score": {
      "type": "object",
      "additionalProperties": false,
      "description": "Thresholds for the pr-score gate (scripts/gate.py). Absent → strict defaults (total_min 22, axis_min 4). Merge permission is NOT here — it is agent_may_merge above, which the gate also honors (false → a passing score still escalates to the human).",
      "properties": {
        "total_min": {
          "type": "integer",
          "default": 22,
          "description": "Minimum sum across the 5 axes (each 1-5, max 25) for an auto-merge verdict."
        },
        "axis_min": {
          "type": "integer",
          "default": 4,
          "description": "Minimum score every single axis must reach for an auto-merge verdict."
        }
      }
    }
  }
}
