{
  "agent_may_merge": true,
  "protected_branch": "main",
  "integration_branch": "develop",
  "generated_trees": [],
  "egress_allow": [
    "localhost",
    "127.0.0.1",
    "::1",
    "www.githubstatus.com"
  ],
  "owner_lens": true,
  "reserved_paths_hard": [
    {
      "glob": ".github/context-budget.json",
      "why": "la configuracion de context-budget: modo, topes y checks que solo avisan. Aflojarla es decision del mantenedor"
    },
    {
      "glob": ".github/workflows/context-budget.yml",
      "why": "el workflow que corre context-budget: quitarlo, cambiarle el modo o el pin afloja el control"
    }
  ]
}
